{
  "$schema": "http://json-schema.org/draft-07/schema#",
  "title": "matrix-year statistics",
  "type": "object",
  "required": [
    "schema_version",
    "scope",
    "generated_at",
    "account",
    "coverage",
    "summary"
  ],
  "additionalProperties": false,
  "properties": {
    "schema_version": {
      "type": "integer",
      "minimum": 1
    },

    "scope": {
      "type": "object",
      "required": ["type", "key"],
      "additionalProperties": false,
      "properties": {
        "type": {
          "type": "string",
          "enum": ["year", "month", "week", "day", "life"]
        },
        "key": {
          "type": "string",
          "description": "Identifier for the window. Examples: '2025', '2025-03', '2025-W12', '2025-03-15', 'life'."
        },
        "label": {
          "type": ["string", "null"],
          "description": "Optional human-friendly label for rendering."
        }
      }
    },

    "generated_at": {
      "type": "string",
      "format": "date"
    },

    "account": {
      "type": "object",
      "required": ["user_id", "rooms_total"],
      "additionalProperties": false,
      "properties": {
        "user_id": { "type": "string" },
        "display_name": { "type": ["string", "null"] },
        "avatar_url": { "type": ["string", "null"] },
        "rooms_total": { "type": "integer", "minimum": 0 }
      }
    },

    "coverage": {
      "type": "object",
      "required": ["from", "to"],
      "additionalProperties": false,
      "properties": {
        "from": { "type": "string", "format": "date" },
        "to": { "type": "string", "format": "date" },
        "days_active": { "type": "integer", "minimum": 0 }
      }
    },

    "summary": {
      "type": "object",
      "required": ["messages_sent", "active_rooms"],
      "additionalProperties": false,
      "properties": {
        "messages_sent": { "type": "integer", "minimum": 0 },
        "active_rooms": { "type": "integer", "minimum": 0 },

        "dm_rooms": { "type": "integer", "minimum": 0 },
        "public_rooms": { "type": "integer", "minimum": 0 },
        "private_rooms": { "type": "integer", "minimum": 0 },

        

        "peak_month": {
          "type": "object",
          "required": ["month", "messages"],
          "additionalProperties": false,
          "properties": {
            "month": { "type": "string" },
            "messages": { "type": "integer", "minimum": 0 }
          }
        }
      }
    },

    "activity": {
      "type": "object",
      "additionalProperties": false,
      "properties": {
        "by_month": {
          "type": "object",
          "additionalProperties": { "type": "integer", "minimum": 0 }
        },
        "by_week": {
          "type": "object",
          "additionalProperties": { "type": "integer", "minimum": 0 }
        },
        "by_weekday": {
          "type": "object",
          "additionalProperties": { "type": "integer", "minimum": 0 }
        },
        "by_hour": {
          "type": "object",
          "additionalProperties": { "type": "integer", "minimum": 0 }
        },
        "by_day": {
          "type": "object",
          "additionalProperties": { "type": "integer", "minimum": 0 }
        },
        "by_year": {
          "type": "object",
          "additionalProperties": { "type": "integer", "minimum": 0 }
        }
      }
    },

    "rooms": {
      "type": "object",
      "required": ["total"],
      "additionalProperties": false,
      "description": "Activity in joined rooms (DMs, private rooms, and public rooms).",
      "properties": {
        "total": { "type": "integer", "minimum": 0 },
        "messages_by_room_type": {
          "type": "object",
          "additionalProperties": false,
          "properties": {
            "dm": { "type": "integer", "minimum": 0 },
            "private": { "type": "integer", "minimum": 0 },
            "public": { "type": "integer", "minimum": 0 }
          }
        },
        "top": {
          "type": "array",
          "items": {
            "type": "object",
             "required": ["messages", "permalink"],
            "additionalProperties": false,
            "properties": {
              "name": { "type": ["string", "null"] },
              "messages": { "type": "integer", "minimum": 0 },
              "percentage": { "type": "number", "minimum": 0, "maximum": 100 },
              "permalink": { "type": "string", "format": "uri" }
            }
          }
        }
      }
    },

    "reactions": {
      "type": "object",
      "additionalProperties": false,
      "properties": {
        "total": { "type": "integer", "minimum": 0 },
        "top_emojis": {
          "type": "array",
          "items": {
            "type": "object",
            "required": ["emoji", "count"],
            "additionalProperties": false,
            "properties": {
              "emoji": { "type": "string" },
              "count": { "type": "integer", "minimum": 0 }
            }
          }
        },
        "top_messages": {
          "type": "array",
          "items": {
            "type": "object",
            "required": ["permalink", "reaction_count"],
            "additionalProperties": false,
            "properties": {
              "permalink": { "type": "string", "format": "uri" },
              "reaction_count": { "type": "integer", "minimum": 0 }
            }
          }
        }
      }
    },

    "created_rooms": {
      "type": "object",
      "required": ["total"],
      "additionalProperties": false,
      "properties": {
        "total": { "type": "integer", "minimum": 0 },
        "dm_rooms": { "type": "integer", "minimum": 0 },
        "public_rooms": { "type": "integer", "minimum": 0 },
        "private_rooms": { "type": "integer", "minimum": 0 }
      }
    },

    "fun": {
      "type": "object",
      "additionalProperties": true
    }
  }
}
